<?xml version="1.0" encoding="UTF-8" ?>
<?xml-stylesheet type="text/xsl" href="university.xsl"?>

<!DOCTYPE root 
[
  <!ELEMENT root (row+)>
  <!ELEMENT row (name,address, courses+, students+, faculty+)>
  <!ELEMENT name (#PCDATA)>
  <!ELEMENT address (street, city, region, country, zipCode)>
  <!ELEMENT street (#PCDATA)>
  <!ELEMENT city (#PCDATA)>
  <!ELEMENT region (#PCDATA)>
  <!ELEMENT country (#PCDATA)>
  <!ELEMENT zipCode (#PCDATA)>
  <!ELEMENT courses (id, title, description)>
  <!ELEMENT id (#PCDATA)>
  <!ELEMENT title (#PCDATA)>
  <!ELEMENT description (#PCDATA)>
  <!ELEMENT students (id, firstName, lastName, dob, email)>
  <!ELEMENT firstName (#PCDATA)>
  <!ELEMENT lastName (#PCDATA)>
  <!ELEMENT dob (#PCDATA)>
  <!ELEMENT email (#PCDATA)>
  <!ELEMENT faculty (id, firstName, lastName, email, phoneNumber)>
  <!ELEMENT phoneNumber (#PCDATA)>
]>
<root>
  <row>
    <name>Technological University (Lashio)</name>
    <address>
      <street>2090 Veith Junction</street>
      <city>Oxford</city>
      <region>Nova Scotia</region>
      <country>Canada</country>
      <zipCode>K7A</zipCode>
    </address>
    <courses>
      <id>b5aebb3e-73b4-4ef2-85c7-06b6e098212e</id>
      <title>sed ante vivamus</title>
      <description>Integer ac leo. Pellentesque ultrices mattis odio. Donec vitae nisi.</description>
    </courses>
    <courses>
      <id>56996a2a-6443-4e26-8c0c-e72430bd553f</id>
      <title>vel accumsan</title>
      <description>Maecenas tristique, est et tempus semper, est quam pharetra magna, ac consequat metus sapien ut nunc. Vestibulum ante ipsum primis in faucibus orci luctus et ultrices posuere cubilia Curae; Mauris viverra diam vitae quam. Suspendisse potenti.</description>
    </courses>
    <courses>
      <id>021c7522-e8de-4626-95d7-00ca0fa94e86</id>
      <title>ante vivamus tortor</title>
      <description>Morbi non lectus. Aliquam sit amet diam in magna bibendum imperdiet. Nullam orci pede, venenatis non, sodales sed, tincidunt eu, felis.</description>
    </courses>
    <courses>
      <id>af46644a-5906-47f2-b815-cca10450f40f</id>
      <title>sit amet nunc</title>
      <description>Integer ac leo. Pellentesque ultrices mattis odio. Donec vitae nisi.</description>
    </courses>
    <courses>
      <id>cd892900-040d-4c0b-9613-1dcdbfb21ef4</id>
      <title>sollicitudin ut suscipit</title>
      <description>Cras mi pede, malesuada in, imperdiet et, commodo vulputate, justo. In blandit ultrices enim. Lorem ipsum dolor sit amet, consectetuer adipiscing elit.</description>
    </courses>
    <students>
      <id>4e18c3de-df7e-42c6-a450-5443386fcbda</id>
      <firstName>Arlen</firstName>
      <lastName>Wakeham</lastName>
      <dob>2000-06-07</dob>
      <email>awakeham0@surveymonkey.com</email>
    </students>
    <students>
      <id>b6c334a5-2704-4bd7-a7bb-d6f21f1a1fc5</id>
      <firstName>Remington</firstName>
      <lastName>McGroarty</lastName>
      <dob>1995-11-01</dob>
      <email>rmcgroarty1@xinhuanet.com</email>
    </students>
    <students>
      <id>1c3f332f-6c90-4181-ac1f-86eb0b82aaa2</id>
      <firstName>Salmon</firstName>
      <lastName>Farnin</lastName>
      <dob>2001-03-12</dob>
      <email>sfarnin2@merriam-webster.com</email>
    </students>
    <students>
      <id>076de0b1-5518-4bc2-ad1f-fee54ca53b84</id>
      <firstName>Guenna</firstName>
      <lastName>Colebourn</lastName>
      <dob>2000-02-17</dob>
      <email>gcolebourn3@gravatar.com</email>
    </students>
    <students>
      <id>d36830cc-1c0d-4068-8886-dc1d75ac4e5a</id>
      <firstName>Riley</firstName>
      <lastName>Davidavidovics</lastName>
      <dob>1994-10-03</dob>
      <email>rdavidavidovics4@ft.com</email>
    </students>
    <students>
      <id>cde61ab8-6afb-4fed-b51b-4e9bd5db1571</id>
      <firstName>Florry</firstName>
      <lastName>Gilluley</lastName>
      <dob>2001-08-05</dob>
      <email>fgilluley5@microsoft.com</email>
    </students>
    <students>
      <id>9ec9b4a6-24f9-4f46-9a9e-40a5617c97ee</id>
      <firstName>Eustace</firstName>
      <lastName>Kardos</lastName>
      <dob>1996-06-29</dob>
      <email>ekardos6@comcast.net</email>
    </students>
    <faculty>
      <id>32baf3cf-76c5-4805-b1ae-aa4486347226</id>
      <firstName>Sean</firstName>
      <lastName>Holburn</lastName>
      <email>sholburn0@de.vu</email>
      <phoneNumber>779-600-8723</phoneNumber>
    </faculty>
    <faculty>
      <id>78ae15b3-9f72-400b-8e03-c451fd3dbec4</id>
      <firstName>Cobbie</firstName>
      <lastName>Reijmers</lastName>
      <email>creijmers1@uiuc.edu</email>
      <phoneNumber>647-670-6414</phoneNumber>
    </faculty>
    <faculty>
      <id>6aceaf58-c63b-4869-b131-bb493005ea14</id>
      <firstName>Gabrielle</firstName>
      <lastName>Gascone</lastName>
      <email>ggascone2@intel.com</email>
      <phoneNumber>500-987-1258</phoneNumber>
    </faculty>
  </row>
  <row>
    <name>University of Pittsburgh at Bradford</name>
    <address>
      <street>516 Merry Alley</street>
      <city>Washington</city>
      <region>District of Columbia</region>
      <country>United States</country>
      <zipCode>20088</zipCode>
    </address>
    <courses>
      <id>c65b08e2-1bf6-4601-908a-d05375f8cdfe</id>
      <title>montes nascetur ridiculus</title>
      <description>Integer ac leo. Pellentesque ultrices mattis odio. Donec vitae nisi.</description>
    </courses>
    <courses>
      <id>cddd1173-8cf7-4de7-92c0-e17facc360d2</id>
      <title>non</title>
      <description>Maecenas leo odio, condimentum id, luctus nec, molestie sed, justo. Pellentesque viverra pede ac diam. Cras pellentesque volutpat dui.</description>
    </courses>
    <courses>
      <id>4e1d9d33-b73a-493f-ab3e-0f0c9c64f822</id>
      <title>mi nulla ac</title>
      <description>Aliquam quis turpis eget elit sodales scelerisque. Mauris sit amet eros. Suspendisse accumsan tortor quis turpis.</description>
    </courses>
    <courses>
      <id>ac82d99c-bdfd-4f3a-8a31-1647e49d3c56</id>
      <title>duis bibendum felis</title>
      <description>Duis bibendum, felis sed interdum venenatis, turpis enim blandit mi, in porttitor pede justo eu massa. Donec dapibus. Duis at velit eu est congue elementum.</description>
    </courses>
    <courses>
      <id>7d32b94b-bd3f-4152-858e-f32fb0d4c2fd</id>
      <title>pretium</title>
      <description>Vestibulum ac est lacinia nisi venenatis tristique. Fusce congue, diam id ornare imperdiet, sapien urna pretium nisl, ut volutpat sapien arcu sed augue. Aliquam erat volutpat.</description>
    </courses>
    <students>
      <id>110217bf-1204-4e63-9167-981e60845b7c</id>
      <firstName>Shane</firstName>
      <lastName>Lavell</lastName>
      <dob>1999-09-12</dob>
      <email>slavell0@samsung.com</email>
    </students>
    <students>
      <id>d7099a60-3803-4a5f-9d78-9b57d7283f52</id>
      <firstName>Dominique</firstName>
      <lastName>Kadwallider</lastName>
      <dob>2001-06-28</dob>
      <email>dkadwallider1@google.ca</email>
    </students>
    <students>
      <id>0b1d702c-e27f-4dd8-a044-3e265a43445c</id>
      <firstName>Jonah</firstName>
      <lastName>Grammer</lastName>
      <dob>1991-10-07</dob>
      <email>jgrammer2@elegantthemes.com</email>
    </students>
    <students>
      <id>baedf9ed-bb79-45be-a15b-da09c1a847a8</id>
      <firstName>Clo</firstName>
      <lastName>Holby</lastName>
      <dob>1999-01-23</dob>
      <email>cholby3@msn.com</email>
    </students>
    <students>
      <id>a0c69ec8-787d-4be3-9c8d-785a477d77ef</id>
      <firstName>Angeli</firstName>
      <lastName>Faveryear</lastName>
      <dob>1993-12-07</dob>
      <email>afaveryear4@etsy.com</email>
    </students>
    <students>
      <id>38e69a42-66e6-4672-93b2-5b04e6a4bd77</id>
      <firstName>Hermione</firstName>
      <lastName>Dawton</lastName>
      <dob>1991-12-15</dob>
      <email>hdawton5@soup.io</email>
    </students>
    <students>
      <id>f20120a7-ae7f-486e-a6bd-b9bbaecc4104</id>
      <firstName>Kimberly</firstName>
      <lastName>Godart</lastName>
      <dob>1999-07-06</dob>
      <email>kgodart6@wired.com</email>
    </students>
    <faculty>
      <id>245d8450-5745-457a-9e7b-735989f06d5c</id>
      <firstName>Mickie</firstName>
      <lastName>Geratt</lastName>
      <email>mgeratt0@wiley.com</email>
      <phoneNumber>631-336-8663</phoneNumber>
    </faculty>
    <faculty>
      <id>59886624-4cfc-4d24-9ca7-1f3650e17943</id>
      <firstName>Armando</firstName>
      <lastName>Osant</lastName>
      <email>aosant1@sphinn.com</email>
      <phoneNumber>828-614-5479</phoneNumber>
    </faculty>
    <faculty>
      <id>ae37528a-83b1-4b88-a2f7-9480ebdf579d</id>
      <firstName>Mart</firstName>
      <lastName>Wall</lastName>
      <email>mwall2@domainmarket.com</email>
      <phoneNumber>852-952-1296</phoneNumber>
    </faculty>
  </row>
  <row>
    <name>School of Design and Crafts</name>
    <address>
      <street>7 Valley Edge Parkway</street>
      <city>Pasadena</city>
      <region>California</region>
      <country>United States</country>
      <zipCode>91199</zipCode>
    </address>
    <courses>
      <id>9f5ba6bf-0413-4991-8f77-fa2256174879</id>
      <title>nibh quisque</title>
      <description>Proin eu mi. Nulla ac enim. In tempor, turpis nec euismod scelerisque, quam turpis adipiscing lorem, vitae mattis nibh ligula nec sem.</description>
    </courses>
    <courses>
      <id>c4d985a9-7985-4ab2-b349-dccd685cb541</id>
      <title>a pede</title>
      <description>Sed ante. Vivamus tortor. Duis mattis egestas metus.</description>
    </courses>
    <courses>
      <id>d12c4178-24a5-468f-9859-49018b6483f8</id>
      <title>nec nisi</title>
      <description>In hac habitasse platea dictumst. Etiam faucibus cursus urna. Ut tellus.</description>
    </courses>
    <courses>
      <id>b73c4e18-1a52-43d0-8a97-7b8fd53a25f3</id>
      <title>iaculis justo in</title>
      <description>In congue. Etiam justo. Etiam pretium iaculis justo.</description>
    </courses>
    <courses>
      <id>12b25f2e-28fb-492a-b33f-6251bfdf4bc6</id>
      <title>morbi odio</title>
      <description>Nam ultrices, libero non mattis pulvinar, nulla pede ullamcorper augue, a suscipit nulla elit ac nulla. Sed vel enim sit amet nunc viverra dapibus. Nulla suscipit ligula in lacus.</description>
    </courses>
    <students>
      <id>d4366135-1bbf-43ee-8c47-aa9b85acca3f</id>
      <firstName>Bevon</firstName>
      <lastName>Wilderspoon</lastName>
      <dob>1997-11-13</dob>
      <email>bwilderspoon0@webs.com</email>
    </students>
    <students>
      <id>e5d4a1c2-8f8e-4bfa-ab34-e2305cb0ffa2</id>
      <firstName>Tiffany</firstName>
      <lastName>Brouwer</lastName>
      <dob>1991-10-24</dob>
      <email>tbrouwer1@webmd.com</email>
    </students>
    <students>
      <id>db76f6e9-ba29-4eb2-ac19-50afc77e857b</id>
      <firstName>Ronda</firstName>
      <lastName>Call</lastName>
      <dob>1995-02-13</dob>
      <email>rcall2@china.com.cn</email>
    </students>
    <students>
      <id>f3eddc04-6ea8-4340-b1da-bf921bf59a6e</id>
      <firstName>Kacy</firstName>
      <lastName>Glacken</lastName>
      <dob>1998-01-24</dob>
      <email>kglacken3@sourceforge.net</email>
    </students>
    <students>
      <id>b24c6ad3-3161-4b57-8bb4-064661a94daa</id>
      <firstName>Lesli</firstName>
      <lastName>Sturm</lastName>
      <dob>1994-03-25</dob>
      <email>lsturm4@blog.com</email>
    </students>
    <students>
      <id>1f2b72ea-8a80-444c-a667-cee74bcb6eca</id>
      <firstName>Prue</firstName>
      <lastName>Coils</lastName>
      <dob>1997-11-30</dob>
      <email>pcoils5@ted.com</email>
    </students>
    <students>
      <id>c5bb7f87-b7bd-4ddc-ad0e-a73b4b01b686</id>
      <firstName>Ave</firstName>
      <lastName>Mateja</lastName>
      <dob>1993-06-07</dob>
      <email>amateja6@narod.ru</email>
    </students>
    <faculty>
      <id>9ac119c3-5cf4-4856-8537-3afdfc69485c</id>
      <firstName>Lissy</firstName>
      <lastName>Hovenden</lastName>
      <email>lhovenden0@bloglines.com</email>
      <phoneNumber>792-490-3083</phoneNumber>
    </faculty>
    <faculty>
      <id>244f3d62-45a4-4a64-bd24-27ecd9dd34a5</id>
      <firstName>Brig</firstName>
      <lastName>Bowman</lastName>
      <email>bbowman1@squarespace.com</email>
      <phoneNumber>679-740-8179</phoneNumber>
    </faculty>
    <faculty>
      <id>0bf12f14-7588-4ac5-b544-c4718132841d</id>
      <firstName>Bette</firstName>
      <lastName>Tuny</lastName>
      <email>btuny2@reuters.com</email>
      <phoneNumber>164-516-0424</phoneNumber>
    </faculty>
  </row>
  <row>
    <name>Arizona State University</name>
    <address>
      <street>31298 Merrick Junction</street>
      <city>Sioux City</city>
      <region>Iowa</region>
      <country>United States</country>
      <zipCode>51105</zipCode>
    </address>
    <courses>
      <id>4e45777d-a2a8-44f4-9e18-443aebbf1103</id>
      <title>luctus</title>
      <description>Morbi porttitor lorem id ligula. Suspendisse ornare consequat lectus. In est risus, auctor sed, tristique in, tempus sit amet, sem.</description>
    </courses>
    <courses>
      <id>295d6c84-16fe-4be1-acf0-2c4d413d0d21</id>
      <title>nulla neque</title>
      <description>Morbi non lectus. Aliquam sit amet diam in magna bibendum imperdiet. Nullam orci pede, venenatis non, sodales sed, tincidunt eu, felis.</description>
    </courses>
    <courses>
      <id>2c751758-11a7-4e1d-9f7a-1e1b55b9e6f1</id>
      <title>ridiculus</title>
      <description>Fusce posuere felis sed lacus. Morbi sem mauris, laoreet ut, rhoncus aliquet, pulvinar sed, nisl. Nunc rhoncus dui vel sem.</description>
    </courses>
    <courses>
      <id>eab30231-d9cb-4490-86d0-d37fd726b78f</id>
      <title>sem</title>
      <description>Phasellus sit amet erat. Nulla tempus. Vivamus in felis eu sapien cursus vestibulum.</description>
    </courses>
    <courses>
      <id>0dee64b1-2246-4517-bf6c-3ed256e5650b</id>
      <title>vulputate ut</title>
      <description>In sagittis dui vel nisl. Duis ac nibh. Fusce lacus purus, aliquet at, feugiat non, pretium quis, lectus.</description>
    </courses>
    <students>
      <id>87507099-6a33-43e4-925c-832e759497fb</id>
      <firstName>Leah</firstName>
      <lastName>Parlett</lastName>
      <dob>1994-10-23</dob>
      <email>lparlett0@exblog.jp</email>
    </students>
    <students>
      <id>e5645d70-83b2-47ca-93c5-fe2bbcc75187</id>
      <firstName>Hildagarde</firstName>
      <lastName>Velasquez</lastName>
      <dob>1996-05-15</dob>
      <email>hvelasquez1@foxnews.com</email>
    </students>
    <students>
      <id>fddbc324-3260-4a22-a3bc-0bb246a206f2</id>
      <firstName>Rollin</firstName>
      <lastName>Albany</lastName>
      <dob>1990-04-23</dob>
      <email>ralbany2@yolasite.com</email>
    </students>
    <students>
      <id>4a70a2bd-d6b6-400e-8b6a-be3cbab01f9b</id>
      <firstName>Dael</firstName>
      <lastName>Nacci</lastName>
      <dob>1991-08-21</dob>
      <email>dnacci3@seesaa.net</email>
    </students>
    <students>
      <id>f0a77b61-5c74-4bab-80a0-124e471825fe</id>
      <firstName>Janelle</firstName>
      <lastName>Meritt</lastName>
      <dob>2001-04-08</dob>
      <email>jmeritt4@diigo.com</email>
    </students>
    <students>
      <id>800e9702-f190-4fdf-84fc-f895258d9243</id>
      <firstName>Elvyn</firstName>
      <lastName>Shaw</lastName>
      <dob>1992-07-09</dob>
      <email>eshaw5@plala.or.jp</email>
    </students>
    <students>
      <id>f62e7ec3-3118-444e-9c66-186f1039de71</id>
      <firstName>Akim</firstName>
      <lastName>Middup</lastName>
      <dob>1996-04-16</dob>
      <email>amiddup6@microsoft.com</email>
    </students>
    <faculty>
      <id>f22e701c-fcd6-4cd9-982a-40dfd57ba30e</id>
      <firstName>Obadiah</firstName>
      <lastName>Itzkowicz</lastName>
      <email>oitzkowicz0@msn.com</email>
      <phoneNumber>435-801-0928</phoneNumber>
    </faculty>
    <faculty>
      <id>29a3bd51-6936-4c3c-b596-2474d91b3c73</id>
      <firstName>Lilla</firstName>
      <lastName>Synan</lastName>
      <email>lsynan1@symantec.com</email>
      <phoneNumber>996-541-6142</phoneNumber>
    </faculty>
    <faculty>
      <id>8f129a2a-6c98-46f8-8d50-c3fd9e6e4c1c</id>
      <firstName>Rosaleen</firstName>
      <lastName>Woollacott</lastName>
      <email>rwoollacott2@addtoany.com</email>
      <phoneNumber>623-648-2730</phoneNumber>
    </faculty>
  </row>
  <row>
    <name>International Medical &amp; Technological University</name>
    <address>
      <street>1 Luster Terrace</street>
      <city>Anchorage</city>
      <region>Alaska</region>
      <country>United States</country>
      <zipCode>99522</zipCode>
    </address>
    <courses>
      <id>5ad46d0e-ea42-4479-b743-60baa30c2419</id>
      <title>ipsum</title>
      <description>Quisque id justo sit amet sapien dignissim vestibulum. Vestibulum ante ipsum primis in faucibus orci luctus et ultrices posuere cubilia Curae; Nulla dapibus dolor vel est. Donec odio justo, sollicitudin ut, suscipit a, feugiat et, eros.</description>
    </courses>
    <courses>
      <id>14f9af4e-5ea3-49b7-912c-694f9e325bf3</id>
      <title>luctus et</title>
      <description>Duis consequat dui nec nisi volutpat eleifend. Donec ut dolor. Morbi vel lectus in quam fringilla rhoncus.</description>
    </courses>
    <courses>
      <id>bba63762-a1bc-40d4-b171-8d4a6772c991</id>
      <title>odio consequat</title>
      <description>Quisque id justo sit amet sapien dignissim vestibulum. Vestibulum ante ipsum primis in faucibus orci luctus et ultrices posuere cubilia Curae; Nulla dapibus dolor vel est. Donec odio justo, sollicitudin ut, suscipit a, feugiat et, eros.</description>
    </courses>
    <courses>
      <id>64314462-2f3e-44b8-ab91-e8f05d470cc5</id>
      <title>leo</title>
      <description>In sagittis dui vel nisl. Duis ac nibh. Fusce lacus purus, aliquet at, feugiat non, pretium quis, lectus.</description>
    </courses>
    <courses>
      <id>10a7c3db-f0d1-4ace-88bf-a28884320f07</id>
      <title>cras</title>
      <description>Phasellus sit amet erat. Nulla tempus. Vivamus in felis eu sapien cursus vestibulum.</description>
    </courses>
    <students>
      <id>2ac62641-3e62-4f50-8483-e31c5f836d66</id>
      <firstName>Wallis</firstName>
      <lastName>Januszkiewicz</lastName>
      <dob>1994-02-10</dob>
      <email>wjanuszkiewicz0@rakuten.co.jp</email>
    </students>
    <students>
      <id>50b75415-c1eb-49e9-9608-aa2823509fd7</id>
      <firstName>Waneta</firstName>
      <lastName>Bohan</lastName>
      <dob>1996-05-18</dob>
      <email>wbohan1@npr.org</email>
    </students>
    <students>
      <id>dd1745ca-8430-4819-aac8-d4d8df30b297</id>
      <firstName>Amber</firstName>
      <lastName>Souten</lastName>
      <dob>1998-03-09</dob>
      <email>asouten2@microsoft.com</email>
    </students>
    <students>
      <id>51a37ca5-0e60-4c6f-8aa8-5f6803be3d23</id>
      <firstName>Freddie</firstName>
      <lastName>Thistleton</lastName>
      <dob>1994-02-22</dob>
      <email>fthistleton3@alibaba.com</email>
    </students>
    <students>
      <id>4af55289-bf0d-43df-b8d7-4604c39b37cb</id>
      <firstName>Valle</firstName>
      <lastName>Baudin</lastName>
      <dob>1999-10-07</dob>
      <email>vbaudin4@paypal.com</email>
    </students>
    <students>
      <id>41fbe07c-16da-4cdb-beb2-b4fff968c59f</id>
      <firstName>Regan</firstName>
      <lastName>Knibley</lastName>
      <dob>1998-12-06</dob>
      <email>rknibley5@alexa.com</email>
    </students>
    <students>
      <id>e11fa074-dd6c-4a12-9d7c-4a34ef0718e7</id>
      <firstName>Delinda</firstName>
      <lastName>Smitherham</lastName>
      <dob>1991-01-07</dob>
      <email>dsmitherham6@blogtalkradio.com</email>
    </students>
    <faculty>
      <id>8b943f66-7cf8-4e3c-bc52-12fba0131775</id>
      <firstName>Colin</firstName>
      <lastName>Imms</lastName>
      <email>cimms0@europa.eu</email>
      <phoneNumber>658-725-1208</phoneNumber>
    </faculty>
    <faculty>
      <id>2c50167a-494e-4d52-849f-532956d9b1c5</id>
      <firstName>Corinna</firstName>
      <lastName>Durker</lastName>
      <email>cdurker1@shutterfly.com</email>
      <phoneNumber>169-124-5547</phoneNumber>
    </faculty>
    <faculty>
      <id>8e663ce2-a017-42e9-842e-b4fe2f4c3211</id>
      <firstName>Gabbie</firstName>
      <lastName>Preble</lastName>
      <email>gpreble2@hexun.com</email>
      <phoneNumber>329-701-5276</phoneNumber>
    </faculty>
  </row>
  <row>
    <name>Academy of Music &#x27;Georghe Dima&#x27; Cluj-Napoca</name>
    <address>
      <street>968 School Court</street>
      <city>Newmarket</city>
      <region>Ontario</region>
      <country>Canada</country>
      <zipCode>L9N</zipCode>
    </address>
    <courses>
      <id>db754ab0-09a8-42ce-a55f-a12aa2a2b392</id>
      <title>id lobortis convallis</title>
      <description>Duis aliquam convallis nunc. Proin at turpis a pede posuere nonummy. Integer non velit.</description>
    </courses>
    <courses>
      <id>ccfe64d8-2528-40a6-9884-aae32e6b9cd5</id>
      <title>ac tellus semper</title>
      <description>Duis bibendum, felis sed interdum venenatis, turpis enim blandit mi, in porttitor pede justo eu massa. Donec dapibus. Duis at velit eu est congue elementum.</description>
    </courses>
    <courses>
      <id>52abf0c0-f74c-457d-affb-91bcef049b17</id>
      <title>aliquet</title>
      <description>Proin leo odio, porttitor id, consequat in, consequat ut, nulla. Sed accumsan felis. Ut at dolor quis odio consequat varius.</description>
    </courses>
    <courses>
      <id>acc66ac2-7169-4257-bab8-ac0d052ac0f0</id>
      <title>interdum venenatis</title>
      <description>Praesent id massa id nisl venenatis lacinia. Aenean sit amet justo. Morbi ut odio.</description>
    </courses>
    <courses>
      <id>557556b8-117e-44a1-99e6-a12a20ab9d61</id>
      <title>donec</title>
      <description>Mauris enim leo, rhoncus sed, vestibulum sit amet, cursus id, turpis. Integer aliquet, massa id lobortis convallis, tortor risus dapibus augue, vel accumsan tellus nisi eu orci. Mauris lacinia sapien quis libero.</description>
    </courses>
    <students>
      <id>9e85c191-4cf2-429c-b9c4-8fe60bc81ec4</id>
      <firstName>Mellisent</firstName>
      <lastName>Collaton</lastName>
      <dob>1997-01-30</dob>
      <email>mcollaton0@pcworld.com</email>
    </students>
    <students>
      <id>7444b1b2-ccb3-4db2-a06d-547c97cb8388</id>
      <firstName>Roley</firstName>
      <lastName>Saph</lastName>
      <dob>1997-01-12</dob>
      <email>rsaph1@jalbum.net</email>
    </students>
    <students>
      <id>72d82250-474c-4df2-9f49-20189a2df0bf</id>
      <firstName>Pammi</firstName>
      <lastName>Goundry</lastName>
      <dob>1996-06-28</dob>
      <email>pgoundry2@dropbox.com</email>
    </students>
    <students>
      <id>cf1b4e8f-1a47-4871-a189-55e94382110c</id>
      <firstName>Everard</firstName>
      <lastName>O&#x27;Brollachain</lastName>
      <dob>1993-11-24</dob>
      <email>eobrollachain3@buzzfeed.com</email>
    </students>
    <students>
      <id>a3ab174c-ca73-493c-9847-07ff4ab1b10b</id>
      <firstName>Max</firstName>
      <lastName>Boydell</lastName>
      <dob>1994-11-11</dob>
      <email>mboydell4@canalblog.com</email>
    </students>
    <students>
      <id>4596e170-985c-4a9b-8f80-ef6362c51566</id>
      <firstName>Kerrin</firstName>
      <lastName>Hordle</lastName>
      <dob>1990-11-24</dob>
      <email>khordle5@amazon.co.jp</email>
    </students>
    <students>
      <id>af5d9749-0929-4035-b269-b8a68308b200</id>
      <firstName>Netti</firstName>
      <lastName>Missen</lastName>
      <dob>1995-04-29</dob>
      <email>nmissen6@alexa.com</email>
    </students>
    <faculty>
      <id>626bf38f-e162-4aae-9f3d-c302032adba3</id>
      <firstName>Codi</firstName>
      <lastName>Tigwell</lastName>
      <email>ctigwell0@vistaprint.com</email>
      <phoneNumber>336-688-4980</phoneNumber>
    </faculty>
    <faculty>
      <id>c365ec20-c931-448e-9322-2583a4fd5d10</id>
      <firstName>Christophe</firstName>
      <lastName>Lazare</lastName>
      <email>clazare1@webmd.com</email>
      <phoneNumber>682-773-0856</phoneNumber>
    </faculty>
    <faculty>
      <id>2354a191-c171-4761-aeed-b5afa2d461d6</id>
      <firstName>Johnathon</firstName>
      <lastName>Tissier</lastName>
      <email>jtissier2@lycos.com</email>
      <phoneNumber>499-107-7677</phoneNumber>
    </faculty>
  </row>
  <row>
    <name>Free University Amsterdam</name>
    <address>
      <street>236 Acker Place</street>
      <city>Washington</city>
      <region>District of Columbia</region>
      <country>United States</country>
      <zipCode>20566</zipCode>
    </address>
    <courses>
      <id>2540973c-98e3-44ec-bdb4-92478f932f47</id>
      <title>quisque id</title>
      <description>Mauris enim leo, rhoncus sed, vestibulum sit amet, cursus id, turpis. Integer aliquet, massa id lobortis convallis, tortor risus dapibus augue, vel accumsan tellus nisi eu orci. Mauris lacinia sapien quis libero.</description>
    </courses>
    <courses>
      <id>4de103b8-42e4-4d82-858f-d16376dfbc27</id>
      <title>accumsan tortor quis</title>
      <description>Maecenas ut massa quis augue luctus tincidunt. Nulla mollis molestie lorem. Quisque ut erat.</description>
    </courses>
    <courses>
      <id>d93d2243-bac7-4f92-8cfb-ae6fff40dd80</id>
      <title>blandit ultrices enim</title>
      <description>Integer tincidunt ante vel ipsum. Praesent blandit lacinia erat. Vestibulum sed magna at nunc commodo placerat.</description>
    </courses>
    <courses>
      <id>e67e5b1b-0f60-4479-b394-79d18b0e0d3a</id>
      <title>ultrices posuere</title>
      <description>Nulla ut erat id mauris vulputate elementum. Nullam varius. Nulla facilisi.</description>
    </courses>
    <courses>
      <id>d4ca4948-e6b5-4cc2-af8a-bf30a3240d44</id>
      <title>neque</title>
      <description>Aliquam quis turpis eget elit sodales scelerisque. Mauris sit amet eros. Suspendisse accumsan tortor quis turpis.</description>
    </courses>
    <students>
      <id>2723f0dd-925b-43f8-97f7-2858af039271</id>
      <firstName>Asher</firstName>
      <lastName>Legier</lastName>
      <dob>1998-11-29</dob>
      <email>alegier0@networkadvertising.org</email>
    </students>
    <students>
      <id>4197f7c9-0de6-475b-a0cb-14601424ed25</id>
      <firstName>Hershel</firstName>
      <lastName>Eagers</lastName>
      <dob>2000-12-15</dob>
      <email>heagers1@flavors.me</email>
    </students>
    <students>
      <id>eea7f4db-a99b-4a53-98f4-c7830c47f12f</id>
      <firstName>Carlie</firstName>
      <lastName>Chasmor</lastName>
      <dob>1998-08-30</dob>
      <email>cchasmor2@stanford.edu</email>
    </students>
    <students>
      <id>f6e609d2-3d8f-4237-a8c8-927ad1fbede6</id>
      <firstName>Gustav</firstName>
      <lastName>Fagg</lastName>
      <dob>1998-04-17</dob>
      <email>gfagg3@themeforest.net</email>
    </students>
    <students>
      <id>ca2ffc11-c5b8-4634-877e-9b1898862a01</id>
      <firstName>Marji</firstName>
      <lastName>Cosins</lastName>
      <dob>1992-10-16</dob>
      <email>mcosins4@uiuc.edu</email>
    </students>
    <students>
      <id>1fe22ddb-0a92-4d45-b7c2-19233413ee0b</id>
      <firstName>Anne</firstName>
      <lastName>Vicarey</lastName>
      <dob>1998-05-17</dob>
      <email>avicarey5@uiuc.edu</email>
    </students>
    <students>
      <id>d2f2f260-b985-4e1b-8e13-5001c4ecb651</id>
      <firstName>Moselle</firstName>
      <lastName>Branscombe</lastName>
      <dob>1998-10-29</dob>
      <email>mbranscombe6@economist.com</email>
    </students>
    <faculty>
      <id>c1d42af7-9885-4f82-b82c-799797b6e211</id>
      <firstName>Chrotoem</firstName>
      <lastName>Gooderidge</lastName>
      <email>cgooderidge0@studiopress.com</email>
      <phoneNumber>816-108-2462</phoneNumber>
    </faculty>
    <faculty>
      <id>b9ba0340-1070-4259-adbf-33f8893c7ce5</id>
      <firstName>Jone</firstName>
      <lastName>Lamberton</lastName>
      <email>jlamberton1@furl.net</email>
      <phoneNumber>117-419-4147</phoneNumber>
    </faculty>
    <faculty>
      <id>ce8989f4-9bc6-46ea-a780-747827d11efc</id>
      <firstName>George</firstName>
      <lastName>MacTague</lastName>
      <email>gmactague2@shutterfly.com</email>
      <phoneNumber>423-871-9987</phoneNumber>
    </faculty>
  </row>
  <row>
    <name>Okinawa University</name>
    <address>
      <street>059 Forest Dale Street</street>
      <city>Washington</city>
      <region>District of Columbia</region>
      <country>United States</country>
      <zipCode>20380</zipCode>
    </address>
    <courses>
      <id>66c624ea-2a68-4918-989a-51525eb80525</id>
      <title>vestibulum</title>
      <description>Duis bibendum. Morbi non quam nec dui luctus rutrum. Nulla tellus.</description>
    </courses>
    <courses>
      <id>e13391b6-b576-4122-99bc-94f6cdee7c1c</id>
      <title>rutrum neque aenean</title>
      <description>In sagittis dui vel nisl. Duis ac nibh. Fusce lacus purus, aliquet at, feugiat non, pretium quis, lectus.</description>
    </courses>
    <courses>
      <id>4c5e661f-fd77-4497-9546-464da9afcd80</id>
      <title>rhoncus aliquam</title>
      <description>Cum sociis natoque penatibus et magnis dis parturient montes, nascetur ridiculus mus. Vivamus vestibulum sagittis sapien. Cum sociis natoque penatibus et magnis dis parturient montes, nascetur ridiculus mus.</description>
    </courses>
    <courses>
      <id>729ee5ed-b50e-459f-86d3-44b415e0a2b2</id>
      <title>adipiscing elit</title>
      <description>Fusce posuere felis sed lacus. Morbi sem mauris, laoreet ut, rhoncus aliquet, pulvinar sed, nisl. Nunc rhoncus dui vel sem.</description>
    </courses>
    <courses>
      <id>2800e891-f1e8-4e18-a914-58bc90c5c2d0</id>
      <title>mauris</title>